Customer ID,Name,Email,Company,Topic,Question,Answer,Timestamp
465f3dc0-a377-482c-a941-0a3a633b9339,richie,richiedieuveil@gmail.com,Suez,General,How happy are you with the SUEZ Smart Metering contract?,happy,2025-09-04 20:44:48
465f3dc0-a377-482c-a941-0a3a633b9339,richie,richiedieuveil@gmail.com,Suez,General,How would you rate the overall smart metering solution?,happy,2025-09-04 20:44:48
465f3dc0-a377-482c-a941-0a3a633b9339,richie,richiedieuveil@gmail.com,Suez,General,What aspects of the solution do you value the most?,,2025-09-04 20:44:48
465f3dc0-a377-482c-a941-0a3a633b9339,richie,richiedieuveil@gmail.com,Suez,General,How strongly would you recommend SUEZ as a Smart Metering Partner?,Neutral,2025-09-04 20:44:48
465f3dc0-a377-482c-a941-0a3a633b9339,richie,richiedieuveil@gmail.com,Suez,General,Any suggestions for improvement in general?,,2025-09-04 20:44:48
